{
  "id": "018f3c2a-b001-7000-a1b2-c3d4e5f60001",
  "revision": "018f3c2a-b001-7000-a1b2-c3d4e5f60001-r1",
  "revision_parent": null,
  "student_id": "018f3c2a-7000-7000-a1b2-c3d4e5f60001",
  "subject_id": "018f3c2a-4000-7000-a1b2-c3d4e5f60001",
  "class_id": "018f3c2a-3000-7000-a1b2-c3d4e5f60001",
  "sequence": "T1-Seq1",
  "owner_teacher_id": "018f3c2a-6000-7000-a1b2-c3d4e5f60003",
  "score": 15.5,
  "max_score": 20,
  "coefficient": null,
  "recorded_at": "2026-06-16T10:00:00Z",
  "synced_time": null,
  "published": false
}
